[
  {
    "id": "audit-fixture-001",
    "siteId": "11111111-1111-4111-8111-111111111111",
    "actorId": "aaaaaaaa-aaaa-4aaa-8aaa-aaaaaaaaaaaa",
    "action": "seed.load",
    "entityType": "site",
    "entityId": "11111111-1111-4111-8111-111111111111",
    "after": { "loaded": true },
    "occurredAt": "2026-05-18T09:00:00.000Z",
    "createdAt": "2026-05-18T09:00:00.000Z",
    "updatedAt": "2026-05-18T09:00:00.000Z"
  }
]

